Question Number,Question Text,Options,Answer
313,"You need to manage multiple Google Cloud projects in the fewest steps possible. You want to configure the Google Cloud SDK command line interface (CLI) so that you can easily manage multiple projects. What should you do?","A. 1. Create a configuration for each project you need to manage. 2. Activate the appropriate configuration when you work with each of your assigned Google Cloud projects. | B. 1. Create a configuration for each project you need to manage. 2. Use gcloud init to update the configuration values when you need to work with a non-default project | C. 1. Use the default configuration for one project you need to manage. 2. Activate the appropriate configuration when you work with each of your assigned Google Cloud projects. | D. 1. Use the default configuration for one project you need to manage. 2. Use gcloud init to update the configuration values when you need to work with a non-default project.",C
314,"You have deployed multiple Linux instances on Compute Engine. You plan on adding more instances in the coming weeks. You want to be able to access all of these instances through your SSH client over the internet without having to configure specific access on the existing and new instances. You do not want the Compute Engine instances to have a public IP. What should you do?","A. Configure Cloud Identity-Aware Proxy for HTTPS resources. | B. Configure Cloud Identity-Aware Proxy for SSH and TCP resources | C. Create an SSH keypair and store the public key as a project-wide SSH Key. | D. Create an SSH keypair and store the private key as a project-wide SSH Key.",B
315,"You have an object in a Cloud Storage bucket that you want to share with an external company. The object contains sensitive data. You want access to the content to be removed after four hours. The external company does not have a Google account to which you can grant specific user-based access privileges. You want to use the most secure method that requires the fewest steps. What should you do?","A. Create a signed URL with a four-hour expiration and share the URL with the company. | B. Set object access to 'public' and use object lifecycle management to remove the object after four hours. | C. Configure the storage bucket as a static website and furnish the object's URL to the company. | D. Create a new Cloud Storage bucket specifically for the external company to access. Copy the object to that bucket. Delete the bucket after four hours.",D
316,"You manage an App Engine Service that aggregates and visualizes data from BigQuery. The application is deployed with the default App Engine Service account. The data that needs to be visualized resides in a different project managed by another team. You do not have access to this project, but you want your application to be able to read data from the BigQuery dataset. What should you do?","A. Ask the other team to grant your default App Engine Service account the role of BigQuery Job User. | B. Ask the other team to grant your default App Engine Service account the role of BigQuery Data Viewer. | C. In Cloud IAM of your project, ensure that the default App Engine service account has the role of BigQuery Data Viewer. | D. In Cloud IAM of your project, grant a newly created service account from the other team the role of BigQuery Job User in your project.",C
317,"You are deploying a production application on Compute Engine. You want to prevent anyone from accidentally destroying the instance by clicking the wrong button. What should you do?","A. Disable the flag 'Delete boot disk when instance is deleted.' | B. Enable delete protection on the instance. | C. Disable Automatic restart on the instance. | D. Enable Preemptibility on the instance.",B
318,"Your company is moving its entire workload to Compute Engine. Some servers should be accessible through the Internet, and other servers should only be accessible over the internal network. All servers need to be able to talk to each other over specific ports and protocols. The current on-premises network relies on a demilitarized zone (DMZ) for the public servers and a Local Area Network (LAN) for the private servers. You need to design the networking infrastructure on Google Cloud to match these requirements. What should you do?","A. 1. Create a single VPC with a subnet for the DMZ and a subnet for the LAN. 2. Set up firewall rules to open up relevant traffic between the DMZ and the LAN subnets, and another firewall rule to allow public ingress traffic for the DMZ. | B. 1. Create a single VPC with a subnet for the DMZ and a subnet for the LAN. 2. Set up firewall rules to open up relevant traffic between the DMZ and the LAN subnets, and another firewall rule to allow public egress traffic for the DMZ. | C. 1. Create a VPC with a subnet for the DMZ and another VPC with a subnet for the LAN. 2. Set up firewall rules to open up relevant traffic between the DMZ and the LAN subnets, and another firewall rule to allow public ingress traffic for the DMZ. | D. 1. Create a VPC with a subnet for the DMZ and another VPC with a subnet for the LAN. 2. Set up firewall rules to open up relevant traffic between the DMZ and the LAN subnets, and another firewall rule to allow public egress traffic for the DMZ.",C
319,"You have been asked to set up Object Lifecycle Management for objects stored in storage buckets. The objects are written once and accessed frequently for 30 days. After 30 days, the objects are not read again unless there is a special need. The objects should be kept for three years, and you need to minimize cost. What should you do?","A. Set up a policy that uses Nearline storage for 30 days and then moves to Archive storage for three years. | B. Set up a policy that uses Standard storage for 30 days and then moves to Archive storage for three years. | C. Set up a policy that uses Nearline storage for 30 days, then moves the Coldline for one year, and then moves to Archive storage for two years. | D. Set up a policy that uses Standard storage for 30 days, then moves to Coldline for one year, and then moves to Archive storage for two years.",B
320,"You have just created a new project which will be used to deploy a globally distributed application. You will use Cloud Spanner for data storage. You want to create a Cloud Spanner instance. You want to perform the first step in preparation of creating the instance. What should you do?","A. Enable the Cloud Spanner API. | B. Configure your Cloud Spanner instance to be multi-regional. | C. Create a new VPC network with subnetworks in all desired regions. | D. Grant yourself the IAM role of Cloud Spanner Admin.",A
321,"You are deploying an application to App Engine. You want the number of instances to scale based on request rate. You need at least 3 unoccupied instances at all times. Which scaling type should you use?","A. Manual Scaling with 3 instances. | B. Basic Scaling with min_instances set to 3. | C. Basic Scaling with max_instances set to 3. | D. Automatic Scaling with min_idle_instances set to 3.",D
322,"You want to select and configure a solution for storing and archiving data on Google Cloud Platform. You need to support compliance objectives for data from one geographic location. This data is archived after 30 days and needs to be accessed annually. What should you do?","A. Select Multi-Regional Storage. Add a bucket lifecycle rule that archives data after 30 days to Coldline Storage. | B. Select Multi-Regional Storage. Add a bucket lifecycle rule that archives data after 30 days to Nearline Storage. | C. Select Regional Storage. Add a bucket lifecycle rule that archives data after 30 days to Nearline Storage. | D. Select Regional Storage. Add a bucket lifecycle rule that archives data after 30 days to Coldline Storage.",D
323,"You have created an application that is packaged into a Docker image. You want to deploy the Docker image as a workload on Google Kubernetes Engine. What should you do?","A. Upload the image to Cloud Storage and create a Kubernetes Service referencing the image. | B. Upload the image to Cloud Storage and create a Kubernetes Deployment referencing the image. | C. Upload the image to Container Registry and create a Kubernetes Service referencing the image. | D. Upload the image to Container Registry and create a Kubernetes Deployment referencing the image.",D
324,"Your organization needs to grant users access to query datasets in BigQuery but prevent them from accidentally deleting the datasets. You want a solution that follows Google-recommended practices. What should you do?","A. Add users to roles/bigquery user role only, instead of roles/bigquery dataOwner. | B. Add users to roles/bigquery dataEditor role only, instead of roles/bigquery dataOwner. | C. Create a custom role by removing delete permissions, and add users to that role only. | D. Create a custom role by removing delete permissions. Add users to the group, and then add the group to the custom role.",D
325,"You have a workload running on Compute Engine that is critical to your business. You want to ensure that the data on the boot disk of this workload is backed up regularly. You need to be able to restore a backup as quickly as possible in case of disaster. You also want older backups to be cleaned automatically to save on cost. You want to follow Google-recommended practices. What should you do?","A. Create a Cloud Function to create an instance template. | B. Create a snapshot schedule for the disk using the desired interval. | C. Create a cron job to create a new disk from the disk using gcloud. | D. Create a Cloud Task to create an image and export it to Cloud Storage.",B
326,"Your company has workloads running on Compute Engine and on-premises. The Google Cloud Virtual Private Cloud (VPC) is connected to your WAN over a Virtual Private Network (VPN). You need to deploy a new Compute Engine instance and ensure that no public Internet traffic can be routed to it. What should you do?","A. Create the instance without a public IP address. | B. Create the instance with Private Google Access enabled. | C. Create a deny-all egress firewall rule on the VPC network. | D. Create a route on the VPC to route all traffic to the instance over the VPN tunnel.",A
